{
  "inspection_id": "INS-000014",
  "return_id": "RET-000110",
  "decision_id": "DEC-000110-1",
  "path": "withdrawal",
  "inspector": "ahmed",
  "photo_id": "PH-000014",
  "created_at": "2026-09-30T18:41:00Z",
  "state": "awaiting_confirmation",
  "checklist": [
    {
      "item": "tag_attached",
      "suggestion": "no",
      "model_confidence": 0.78,
      "note": "No tag visible"
    },
    {
      "item": "visible_damage",
      "suggestion": "yes",
      "model_confidence": 0.71,
      "note": "Stain near the collar"
    },
    {
      "item": "photo_quality",
      "suggestion": "yes",
      "model_confidence": 0.93,
      "note": null
    }
  ],
  "confidence_is_calibrated": false,
  "manual_review_reason": null,
  "proposal": {
    "rule_id": "DV-RULE-1",
    "amount": {
      "value": 17.98,
      "unit": "eur",
      "provenance": {
        "origin": "Contract example: diminished-value rule DV-RULE-1 applied to a synthetic return",
        "period_start": "2025-10-01",
        "period_end": "2026-09-30",
        "nature": "synthetic"
      }
    },
    "basis": [
      "visible_damage"
    ],
    "text": "Visible damage, not resellable as new: 20% of the line price (rule DV-RULE-1)"
  },
  "confirmed_observations": null,
  "confirmed_by": null,
  "confirmed_at": null,
  "generation": {
    "generation_id": "GEN-INS-000014",
    "generation_path": "model",
    "fallback_reason": null,
    "llm_mode": "mock",
    "served_from": "live",
    "model": "mock",
    "model_calls": 1,
    "validator_codes": [],
    "created_at": "2026-09-30T18:41:00Z",
    "latency_ms": null
  },
  "provenance": {
    "origin": "Contract example: vision checklist of the mock model on a synthetic photo (declared confidences)",
    "period_start": "2025-10-01",
    "period_end": "2026-09-30",
    "nature": "synthetic"
  }
}
